[
  {
    "slug": "what-is-jev-ai-typesafe-system-one-model",
    "kicker": "AI Engineering",
    "title": "What is Jev AI? TypeSafe's decision model for the agent era",
    "subtitle": "Jev is not another chatbot. It is a new kind of AI model designed to make fast, structured and probabilistic decisions inside software and AI agent workflows.",
    "excerpt": "Jev AI from TypeSafe is gaining attention for replacing free-form text generation with typed decisions. Here is how Jev works, why it was introduced, who should use it, where it fits beside LLMs, and what it could mean for AI agents.",
    "category": "AI & Engineering",
    "tags": [
      "jev-ai",
      "typesafe-ai",
      "system-one-model",
      "ai-agents",
      "agentic-ai",
      "llm",
      "ai-automation",
      "decision-models",
      "structured-ai"
    ],
    "publishedAt": "2026-09-21",
    "updatedAt": "2026-09-21",
    "readingTime": "11 min read",
    "image": "/images/blog/what-is-jev-ai-typesafe-system-one-model.png?v=2",
    "author": {
      "name": "Ganesh Sharma",
      "role": "Founder, Auto Craft",
      "image": "/images/ganesh-suit-close-up.PNG"
    },
    "content": [
      {
        "type": "heading",
        "level": 2,
        "text": "What is Jev AI?"
      },
      {
        "type": "paragraph",
        "text": "Jev is an AI model developed by TypeSafe AI for making structured decisions inside software. Unlike a traditional large language model such as ChatGPT, Claude or Gemini, Jev is not primarily designed to write paragraphs, hold conversations or generate arbitrary text. Its purpose is much narrower: receive information about a situation and return a decision that software can use directly."
      },
      {
        "type": "paragraph",
        "text": "TypeSafe describes Jev as its first System One Model. The idea is to create an intelligence layer optimized for fast decisions rather than natural-language generation. A developer can give Jev the current state of a workflow and ask it questions such as which tool an AI agent should use, which department should receive a support request, whether an operation appears risky, or whether a result should be reviewed by a human."
      },
      {
        "type": "callout",
        "label": "Jev in one sentence",
        "text": "Jev turns unstructured context into structured decisions with probabilities that normal application code can inspect and act on.",
        "items": [
          "LLMs mainly generate content.",
          "Jev mainly chooses, scores and evaluates.",
          "Its outputs are designed to be consumed by software rather than read as an essay.",
          "It can complement an LLM rather than replacing one."
        ]
      },
      {
        "type": "heading",
        "level": 2,
        "text": "Why was Jev introduced?"
      },
      {
        "type": "paragraph",
        "text": "The rise of AI agents has exposed an important mismatch between language models and software automation. Large language models are extremely capable at understanding instructions and generating text, but an autonomous workflow often does not need another paragraph. It needs a decision."
      },
      {
        "type": "paragraph",
        "text": "An agent may need to decide whether to call a search tool or a database, whether to retry a failed operation, whether a request belongs to billing or technical support, whether a transaction deserves review, or whether it has enough confidence to continue without human approval. Developers can ask a general-purpose LLM to make these choices, but that often means generating and parsing text for a task that ultimately becomes a small branch in code."
      },
      {
        "type": "paragraph",
        "text": "Jev was introduced to attack that problem directly. Instead of optimizing a model around producing language that humans like reading, TypeSafe is attempting to optimize around calibrated decisions that machines can use. That distinction becomes increasingly important as AI moves from chat interfaces into background processes, agents and automated business systems."
      },
      {
        "type": "heading",
        "level": 2,
        "text": "What does TypeSafe mean by a System One Model?"
      },
      {
        "type": "paragraph",
        "text": "TypeSafe uses the term System One Model for AI designed around fast and repeatable decisions. The name borrows conceptually from the distinction between fast intuitive decisions and slower deliberate reasoning, although Jev is an engineered machine-learning system rather than a literal recreation of human cognition."
      },
      {
        "type": "paragraph",
        "text": "For developers, the important part is simpler: Jev is not trying to solve every AI problem. It is deliberately specialized. It accepts state describing the current situation, evaluates questions defined by the developer, and returns structured results with probabilities."
      },
      {
        "type": "list",
        "style": "bullet",
        "items": [
          "Input: the state or context required for a decision.",
          "Question: a developer-defined choice, score or judgement.",
          "Output: a typed answer that application code can consume.",
          "Probability: information about how strongly the model supports a possible outcome.",
          "Application logic: thresholds determine whether software acts automatically or asks for review."
        ]
      },
      {
        "type": "heading",
        "level": 2,
        "text": "How Jev is different from a traditional LLM"
      },
      {
        "type": "paragraph",
        "text": "A general-purpose LLM and Jev may both understand text, but they are designed for different outputs. An LLM is usually asked to continue a sequence of tokens and produce language. Jev is designed to return decisions over possibilities defined by the application."
      },
      {
        "type": "paragraph",
        "text": "Imagine a support message saying that a customer's card was charged twice and they want their money back. A normal LLM might produce a helpful explanation or draft a response. Jev could instead answer questions such as which support category the request belongs to, how urgent it appears, and whether the workflow should be escalated to a person."
      },
      {
        "type": "list",
        "style": "bullet",
        "items": [
          "Use an LLM when you need writing, explanation, summarization or open-ended reasoning.",
          "Use Jev when you already know the possible actions and need intelligence to choose between them.",
          "Use both when an agent needs a structured decision followed by natural-language execution."
        ]
      },
      {
        "type": "heading",
        "level": 3,
        "text": "Jev is not simply JSON mode"
      },
      {
        "type": "paragraph",
        "text": "Modern LLM APIs can already return JSON or follow structured-output schemas, so it is reasonable to ask why Jev is different. JSON mode changes the format of a generative model's output. It does not fundamentally change what that model was trained and optimized to do."
      },
      {
        "type": "paragraph",
        "text": "Jev's proposition is more fundamental: structured decision-making is the primary task rather than a formatting layer added to text generation. In a large automated system, that specialization may matter for latency, cost, consistency and how uncertainty is represented."
      },
      {
        "type": "heading",
        "level": 2,
        "text": "The three kinds of decisions Jev can make"
      },
      {
        "type": "paragraph",
        "text": "Jev's developer model revolves around a small set of decision primitives. Rather than asking an unrestricted question and parsing whatever text comes back, the application describes what kind of decision it needs."
      },
      {
        "type": "heading",
        "level": 3,
        "text": "Choice: select between known options"
      },
      {
        "type": "paragraph",
        "text": "Choice is useful when software already knows the possible destinations. An AI agent could choose between search, database, calculator and browser tools. A customer-service workflow could choose between billing, technical support, account access and cancellation."
      },
      {
        "type": "heading",
        "level": 3,
        "text": "Score: evaluate something on a scale"
      },
      {
        "type": "paragraph",
        "text": "Scoring is useful when the result is not simply one category. A system might estimate severity, relevance, quality, risk or priority and then apply its own thresholds around the returned value."
      },
      {
        "type": "heading",
        "level": 3,
        "text": "Probabilistic yes-or-no judgement"
      },
      {
        "type": "paragraph",
        "text": "Binary questions are useful for gates inside workflows: does this request appear urgent, should this output be reviewed, is the information sufficient to continue, or does this operation appear suspicious? Instead of receiving a paragraph explaining the answer, software can receive a probability and branch accordingly."
      },
      {
        "type": "heading",
        "level": 2,
        "text": "Why calibrated probability matters"
      },
      {
        "type": "paragraph",
        "text": "One of the more interesting ideas behind Jev is that software should not only receive an answer; it should also understand uncertainty. In production systems, being uncertain is often more valuable than confidently making the wrong decision."
      },
      {
        "type": "paragraph",